{
  "version": 1,
  "organization_id": "22222222-2222-4222-8222-222222222222",
  "device_id": "33333333-3333-4333-8333-333333333333",
  "format_epoch": 2,
  "sequence": 7,
  "statement_hash": "aaaaaaaaaaaaaaaaaaaaaaaaaaaaaaaaaaaaaaaaaaaaaaaaaaaaaaaaaaaaaaaa",
  "applied_at": "2026-08-12T00:00:00.000Z",
  "status": "applied"
}
